{
  "slug": "scroll-of-revivify",
  "name": "Spell Scroll (Revivify)",
  "type": "scroll",
  "cost": "300 gp",
  "weight": 0.1,
  "description": "A sacred scroll capable of bringing the recently fallen back to life.",
  "properties": [
    "Scroll",
    "Consumable"
  ],
  "quantity": 1,
  "source": "SRD 5.1",
  "source_ref": "SRD 5.1, Equipment: Spell Scroll (Revivify)",
  "license": "CC-BY-4.0"
}