{
  "slug": "lantern-hooded",
  "name": "Lantern, Hooded",
  "type": "gear",
  "cost": "5 gp",
  "weight": 2,
  "description": "Casts bright light in a 30-foot radius and dim light for 30 more feet. Hood can reduce light.",
  "properties": [],
  "quantity": 1,
  "source": "SRD 5.1",
  "source_ref": "SRD 5.1, Equipment: Lantern, Hooded",
  "license": "CC-BY-4.0"
}