{
  "slug": "greataxe",
  "name": "Greataxe",
  "type": "weapon",
  "cost": "30 gp",
  "weight": 7,
  "description": "A devastating heavy greataxe (1d12 slashing).",
  "properties": [
    "Heavy",
    "Two-Handed"
  ],
  "quantity": 1,
  "source": "SRD 5.1",
  "source_ref": "SRD 5.1, Equipment: Greataxe",
  "license": "CC-BY-4.0"
}