{
  "slug": "greatsword",
  "name": "Greatsword",
  "type": "weapon",
  "cost": "50 gp",
  "weight": 6,
  "description": "A massive two-handed martial sword (2d6 slashing).",
  "properties": [
    "Heavy",
    "Two-Handed"
  ],
  "quantity": 1,
  "source": "SRD 5.1",
  "source_ref": "SRD 5.1, Equipment: Greatsword",
  "license": "CC-BY-4.0"
}