{
  "slug": "bedroll",
  "name": "Bedroll",
  "type": "gear",
  "cost": "1 gp",
  "weight": 7,
  "description": "A wool roll used for sleeping comfortably in the wilderness.",
  "properties": [],
  "quantity": 1,
  "source": "SRD 5.1",
  "source_ref": "SRD 5.1, Equipment: Bedroll",
  "license": "CC-BY-4.0"
}